site_code,source_workbook,source_tab,output_csv,data_level,primary_key,join_keys,row_grain,notes
NDHM,NDHM_APS_deID_PUB.xlsx,Stats,NDHM_APS_stats_key-values.csv,stats,,,one row per metric,Tidy key/value extraction from Stats A-D; sectioned by header rows in col B.
NDHM,NDHM_APS_deID_PUB.xlsx,Stats,NDHM_APS_stats_referral-agreement.csv,stats,,,one row per FL result category,Extract mini-table anchored at 'Number of Tubes with FL Result' (cols E-L); includes pct status columns.
NDHM,NDHM_APS_deID_PUB.xlsx,REF Weekly,NDHM_APS_weekly-summary.csv,weekly_rollup,,week_start_date;week_end_date,one row per week,Weekly screening rollup (imported from RFR when present); includes pct_positive_status.
NDHM,NDHM_APS_deID_PUB.xlsx,Pos and Incl,NDHM_APS_pos-incl-cases.csv,tube,tube_id,tube_id;case_cluster_id,one row per pos/incl tube,Case-centric pos/incl subset with pool membership + referral linkage.
NDHM,NDHM_APS_deID_PUB.xlsx,postDEL,NDHM_APS_swabs-in-tubes.csv,participant_result,,tube_id;participant_id,one row per swab-in-tube row,Trimmed participant-result table; drops QA scaffolding and blank PII columns.
NDHM,NDHM_APS_deID_PUB.xlsx,APS Tubes,NDHM_APS_tubes.csv,tube,tube_id,tube_id,one row per tube,Canonical tube table (Appivo tubes); pool level + timing + results + corrections.
NDHM,NDHM_APS_deID_PUB.xlsx,APS Tubes by Date,NDHM_APS_daily-tubes-rollup.csv,daily_rollup,collect_date,collect_date,one row per collection date,Exports only leftmost A-I rollup table; headers normalized to remove embedded totals.
NDHM,NDHM_RFR_deID_PUB.xlsx,ALL Tube Results,NDHM_RFR_all-tube-results.csv,tube,tube_id,tube_id;final_assigned_run_id,one row per tube,Run linkage + includes ARF tubes (not in Appivo).
NDHM,NDHM_RFR_deID_PUB.xlsx,Weekly,NDHM_RFR_weekly-summary.csv,weekly_rollup,,week_start_date;week_end_date,one row per week,Canonical RFR weekly rollup; includes pct_positive_status.
